{
  "artifacts": {
    "executor_result": "EXECUTED"
  },
  "context_hash": "3d92615f920ff2b0529e0967ce92a957e8616c785969961c5c21746e0488cce5",
  "decision": {
    "action": "send",
    "allowed": true,
    "evidence": {
      "oracle": {
        "present": true,
        "reason_id": "OK_ALLOW",
        "valid": true
      },
      "qid": {
        "present": true,
        "reason_id": "OK_ALLOW",
        "valid": true
      },
      "shield": {
        "present": true,
        "reason_id": "OK_ALLOW",
        "valid": true
      }
    },
    "gates": {
      "eqc": {
        "allowed": true,
        "reason_id": "OK_ALLOW"
      },
      "tva": {
        "allowed": true,
        "reason_id": "OK_ALLOW"
      },
      "wsqk": {
        "allowed": true,
        "reason_id": "OK_ALLOW"
      }
    },
    "intent": "authorize",
    "nonce": {
      "consumed": true,
      "reason_id": "OK_ALLOW",
      "store": "tva",
      "value": "n1"
    },
    "policy": {
      "mode": "STRICT_FAIL_CLOSED",
      "override_allowed": false,
      "reason_id": "OK_ALLOW"
    },
    "protection_mode": "full",
    "timebox": {
      "expires_at": "2024-02-03T20:01:00Z",
      "issued_at": "2024-02-03T20:00:00Z",
      "max_skew_seconds": 0,
      "reason_id": "OK_ALLOW",
      "valid": true
    }
  },
  "reason_id": "OK_ALLOW",
  "request_id": "req-v1_5_0-full-allow",
  "status": "allow",
  "v": "execution_response_v2"
}
